[2025-11-25T16:55:35.711Z] Processing weighted recommendation request 
[2025-11-25T16:55:35.713Z] Processing weighted recommendation request 
[2025-11-25T16:55:35.713Z] 游 generateRecommendations started with weighted algorithm 
[2025-11-25T16:55:35.713Z] 游닌 Input movie slugs: [
  "sinners-2025"
]
[2025-11-25T16:55:35.713Z] 丘뙖잺 Active weights: {
  "collaborative": 0.5,
  "favorite_bonus": 0.15,
  "genre": 0.25,
  "nanogenre": 1,
  "director": 0.05,
  "actor": 0.03,
  "temporal": 0.02
}
[2025-11-25T16:55:35.713Z] INFO: 游늵 STEP 1: Gathering input movie data 
[2025-11-25T16:55:35.715Z] 游 generateRecommendations started with weighted algorithm 
[2025-11-25T16:55:35.715Z] 游닌 Input movie slugs: [
  "sinners-2025"
]
[2025-11-25T16:55:35.715Z] 丘뙖잺 Active weights: {
  "collaborative": 0.5,
  "favorite_bonus": 0.15,
  "genre": 0.25,
  "nanogenre": 1,
  "director": 0.05,
  "actor": 0.03,
  "temporal": 0.02
}
[2025-11-25T16:55:35.715Z] INFO: 游늵 STEP 1: Gathering input movie data 
[2025-11-25T16:55:36.143Z] INFO: 游늵 Loaded 1 input movies 
[2025-11-25T16:55:36.143Z] INFO: 游논 STEP 2: Building user interaction map 
[2025-11-25T16:55:36.147Z] INFO: 游늵 Loaded 1 input movies 
[2025-11-25T16:55:36.148Z] INFO: 游논 STEP 2: Building user interaction map 
[2025-11-25T16:55:36.300Z] INFO: 游논 Movie sinners-2025 liked by users: []
[2025-11-25T16:55:36.301Z] INFO: 
游댌 DEBUG: User Interaction Analysis 
[2025-11-25T16:55:36.301Z] INFO: Total users who interacted: 0 
[2025-11-25T16:55:36.301Z] INFO: 游논 Found 0 users who interacted with input movies 
[2025-11-25T16:55:36.301Z] INFO: Userineractions: {}
[2025-11-25T16:55:36.302Z] INFO: 游꿢 STEP 3: Building candidate movie set 
[2025-11-25T16:55:36.302Z] INFO: User interactions for candidates: {}
[2025-11-25T16:55:36.302Z] INFO: 游꿢 Found 0 candidate movies 
[2025-11-25T16:55:36.302Z] INFO: 游늳 STEP 4: Calculating global statistics 
[2025-11-25T16:55:36.302Z] DEBUG: 游댌 Querying likes - batch 1 
[2025-11-25T16:55:36.305Z] INFO: 游논 Movie sinners-2025 liked by users: []
[2025-11-25T16:55:36.305Z] INFO: 
游댌 DEBUG: User Interaction Analysis 
[2025-11-25T16:55:36.305Z] INFO: Total users who interacted: 0 
[2025-11-25T16:55:36.305Z] INFO: 游논 Found 0 users who interacted with input movies 
[2025-11-25T16:55:36.305Z] INFO: Userineractions: {}
[2025-11-25T16:55:36.305Z] INFO: 游꿢 STEP 3: Building candidate movie set 
[2025-11-25T16:55:36.305Z] INFO: User interactions for candidates: {}
[2025-11-25T16:55:36.305Z] INFO: 游꿢 Found 0 candidate movies 
[2025-11-25T16:55:36.305Z] INFO: 游늳 STEP 4: Calculating global statistics 
[2025-11-25T16:55:36.305Z] DEBUG: 游댌 Querying likes - batch 1 
[2025-11-25T16:55:37.080Z] DEBUG: 游댌 Querying likes - batch 2 
[2025-11-25T16:55:37.617Z] DEBUG: 游댌 Querying likes - batch 3 
[2025-11-25T16:55:38.162Z] DEBUG: 游댌 Querying likes - batch 4 
[2025-11-25T16:55:38.834Z] DEBUG: 游댌 Querying likes - batch 5 
[2025-11-25T16:55:39.439Z] DEBUG: 游댌 Querying likes - batch 6 
[2025-11-25T16:55:40.047Z] DEBUG: 游댌 Querying likes - batch 7 
[2025-11-25T16:55:40.598Z] DEBUG: 游댌 Querying likes - batch 8 
[2025-11-25T16:55:41.229Z] DEBUG: 游댌 Querying likes - batch 9 
[2025-11-25T16:55:41.770Z] DEBUG: 游댌 Querying likes - batch 10 
[2025-11-25T16:55:42.343Z] INFO: 游댌 Progress: 175229 items from likes so far... 
[2025-11-25T16:55:42.343Z] DEBUG: 游댌 Querying likes - batch 11 
[2025-11-25T16:55:42.890Z] DEBUG: 游댌 Querying likes - batch 12 
[2025-11-25T16:55:43.495Z] DEBUG: 游댌 Querying likes - batch 13 
[2025-11-25T16:55:44.094Z] DEBUG: 游댌 Querying likes - batch 14 
[2025-11-25T16:55:44.681Z] DEBUG: 游댌 Querying likes - batch 15 
[2025-11-25T16:55:45.331Z] DEBUG: 游댌 Querying likes - batch 16 
[2025-11-25T16:55:45.634Z] INFO: 游댌 Retrieved 268857 total items from likes in 16 batches 
[2025-11-25T16:55:45.702Z] INFO: 游늳 Global stats: 5000 movies, avg 53.8 likes/movie 
[2025-11-25T16:55:45.702Z] INFO: 游꿛 STEP 5: Scoring candidate movies 
[2025-11-25T16:55:45.703Z] INFO: 游꿛 Scored 0 candidates 
[2025-11-25T16:55:45.703Z] INFO: 游끥 STEP 6: Ranking and diversifying results 
[2025-11-25T16:55:45.703Z] INFO: 游끥 Final recommendations: 
[2025-11-25T16:55:52.382Z] DEBUG: 游댌 Querying likes - batch 2 
[2025-11-25T16:56:04.982Z] DEBUG: 游댌 Querying likes - batch 3 
[2025-11-25T16:56:22.453Z] DEBUG: 游댌 Querying likes - batch 4 
[2025-11-25T16:56:39.056Z] DEBUG: 游댌 Querying likes - batch 5 
[2025-11-25T16:56:51.829Z] DEBUG: 游댌 Querying likes - batch 6 
[2025-11-25T16:57:07.546Z] DEBUG: 游댌 Querying likes - batch 7 
[2025-11-25T16:57:22.532Z] DEBUG: 游댌 Querying likes - batch 8 
[2025-11-25T16:57:38.876Z] DEBUG: 游댌 Querying likes - batch 9 
[2025-11-25T16:57:54.155Z] DEBUG: 游댌 Querying likes - batch 10 
[2025-11-25T16:58:06.599Z] INFO: 游댌 Progress: 175229 items from likes so far... 
[2025-11-25T16:58:06.603Z] DEBUG: 游댌 Querying likes - batch 11 
[2025-11-25T16:58:22.787Z] DEBUG: 游댌 Querying likes - batch 12 
[2025-11-25T16:58:40.208Z] DEBUG: 游댌 Querying likes - batch 13 
[2025-11-25T16:58:54.163Z] DEBUG: 游댌 Querying likes - batch 14 
[2025-11-25T16:59:10.158Z] DEBUG: 游댌 Querying likes - batch 15 
[2025-11-25T16:59:24.790Z] DEBUG: 游댌 Querying likes - batch 16 
[2025-11-25T16:59:30.868Z] INFO: 游댌 Retrieved 268857 total items from likes in 16 batches 
[2025-11-25T16:59:30.962Z] INFO: 游늳 Global stats: 5000 movies, avg 53.8 likes/movie 
[2025-11-25T16:59:30.962Z] INFO: 游꿛 STEP 5: Scoring candidate movies 
[2025-11-25T16:59:30.970Z] INFO: 游꿛 Scored 0 candidates 
[2025-11-25T16:59:30.971Z] INFO: 游끥 STEP 6: Ranking and diversifying results 
[2025-11-25T16:59:30.971Z] INFO: 游끥 Final recommendations: 
