[2025-11-25T16:52:41.573Z] Processing weighted recommendation request 
[2025-11-25T16:52:41.575Z] Processing weighted recommendation request 
[2025-11-25T16:52:41.575Z] 游 generateRecommendations started with weighted algorithm 
[2025-11-25T16:52:41.575Z] 游닌 Input movie slugs: [
  "sinners-2025"
]
[2025-11-25T16:52:41.575Z] 丘뙖잺 Active weights: {
  "collaborative": 0.5,
  "favorite_bonus": 0.15,
  "genre": 0.25,
  "nanogenre": 1,
  "director": 0.05,
  "actor": 0.03,
  "temporal": 0.02
}
[2025-11-25T16:52:41.575Z] INFO: 游늵 STEP 1: Gathering input movie data 
[2025-11-25T16:52:41.576Z] 游 generateRecommendations started with weighted algorithm 
[2025-11-25T16:52:41.576Z] 游닌 Input movie slugs: [
  "sinners-2025"
]
[2025-11-25T16:52:41.576Z] 丘뙖잺 Active weights: {
  "collaborative": 0.5,
  "favorite_bonus": 0.15,
  "genre": 0.25,
  "nanogenre": 1,
  "director": 0.05,
  "actor": 0.03,
  "temporal": 0.02
}
[2025-11-25T16:52:41.576Z] INFO: 游늵 STEP 1: Gathering input movie data 
[2025-11-25T16:52:41.854Z] INFO: 游늵 Loaded 1 input movies 
[2025-11-25T16:52:41.855Z] INFO: 游논 STEP 2: Building user interaction map 
[2025-11-25T16:52:42.003Z] INFO: 游늵 Loaded 1 input movies 
[2025-11-25T16:52:42.003Z] INFO: 游논 STEP 2: Building user interaction map 
[2025-11-25T16:52:42.016Z] INFO: 游논 Movie sinners-2025 liked by users: []
[2025-11-25T16:52:42.017Z] INFO: 
游댌 DEBUG: User Interaction Analysis 
[2025-11-25T16:52:42.017Z] INFO: Total users who interacted: 0 
[2025-11-25T16:52:42.017Z] INFO: 游논 Found 0 users who interacted with input movies 
[2025-11-25T16:52:42.017Z] INFO: Userineractions: {}
[2025-11-25T16:52:42.017Z] INFO: 游꿢 STEP 3: Building candidate movie set 
[2025-11-25T16:52:42.017Z] INFO: User interactions for candidates: {}
[2025-11-25T16:52:42.017Z] INFO: 游꿢 Found 0 candidate movies 
[2025-11-25T16:52:42.017Z] INFO: 游늳 STEP 4: Calculating global statistics 
[2025-11-25T16:52:42.018Z] DEBUG: 游댌 Querying likes - batch 1 
[2025-11-25T16:52:42.161Z] INFO: 游논 Movie sinners-2025 liked by users: []
[2025-11-25T16:52:42.162Z] INFO: 
游댌 DEBUG: User Interaction Analysis 
[2025-11-25T16:52:42.162Z] INFO: Total users who interacted: 0 
[2025-11-25T16:52:42.163Z] INFO: 游논 Found 0 users who interacted with input movies 
[2025-11-25T16:52:42.163Z] INFO: Userineractions: {}
[2025-11-25T16:52:42.163Z] INFO: 游꿢 STEP 3: Building candidate movie set 
[2025-11-25T16:52:42.163Z] INFO: User interactions for candidates: {}
[2025-11-25T16:52:42.164Z] INFO: 游꿢 Found 0 candidate movies 
[2025-11-25T16:52:42.164Z] INFO: 游늳 STEP 4: Calculating global statistics 
[2025-11-25T16:52:42.164Z] DEBUG: 游댌 Querying likes - batch 1 
[2025-11-25T16:52:42.783Z] DEBUG: 游댌 Querying likes - batch 2 
[2025-11-25T16:52:42.848Z] DEBUG: 游댌 Querying likes - batch 2 
[2025-11-25T16:52:43.310Z] DEBUG: 游댌 Querying likes - batch 3 
[2025-11-25T16:52:43.371Z] DEBUG: 游댌 Querying likes - batch 3 
[2025-11-25T16:52:43.830Z] DEBUG: 游댌 Querying likes - batch 4 
[2025-11-25T16:52:43.896Z] DEBUG: 游댌 Querying likes - batch 4 
[2025-11-25T16:52:44.300Z] DEBUG: 游댌 Querying likes - batch 5 
[2025-11-25T16:52:44.417Z] DEBUG: 游댌 Querying likes - batch 5 
[2025-11-25T16:52:44.868Z] DEBUG: 游댌 Querying likes - batch 6 
[2025-11-25T16:52:44.940Z] DEBUG: 游댌 Querying likes - batch 6 
[2025-11-25T16:52:45.270Z] DEBUG: 游댌 Querying likes - batch 7 
[2025-11-25T16:52:45.380Z] DEBUG: 游댌 Querying likes - batch 7 
[2025-11-25T16:52:45.829Z] DEBUG: 游댌 Querying likes - batch 8 
[2025-11-25T16:52:45.961Z] DEBUG: 游댌 Querying likes - batch 8 
[2025-11-25T16:52:46.328Z] DEBUG: 游댌 Querying likes - batch 9 
[2025-11-25T16:52:46.496Z] DEBUG: 游댌 Querying likes - batch 9 
[2025-11-25T16:52:46.853Z] DEBUG: 游댌 Querying likes - batch 10 
[2025-11-25T16:52:47.057Z] DEBUG: 游댌 Querying likes - batch 10 
[2025-11-25T16:52:47.391Z] INFO: 游댌 Progress: 175229 items from likes so far... 
[2025-11-25T16:52:47.392Z] DEBUG: 游댌 Querying likes - batch 11 
[2025-11-25T16:52:47.587Z] INFO: 游댌 Progress: 175229 items from likes so far... 
[2025-11-25T16:52:47.587Z] DEBUG: 游댌 Querying likes - batch 11 
[2025-11-25T16:52:47.840Z] DEBUG: 游댌 Querying likes - batch 12 
[2025-11-25T16:52:48.172Z] DEBUG: 游댌 Querying likes - batch 12 
[2025-11-25T16:52:48.378Z] DEBUG: 游댌 Querying likes - batch 13 
[2025-11-25T16:52:48.631Z] DEBUG: 游댌 Querying likes - batch 13 
[2025-11-25T16:52:48.940Z] DEBUG: 游댌 Querying likes - batch 14 
[2025-11-25T16:52:49.057Z] DEBUG: 游댌 Querying likes - batch 14 
[2025-11-25T16:52:49.481Z] DEBUG: 游댌 Querying likes - batch 15 
[2025-11-25T16:52:49.595Z] DEBUG: 游댌 Querying likes - batch 15 
[2025-11-25T16:52:49.985Z] DEBUG: 游댌 Querying likes - batch 16 
[2025-11-25T16:52:50.150Z] DEBUG: 游댌 Querying likes - batch 16 
[2025-11-25T16:52:50.236Z] INFO: 游댌 Retrieved 268857 total items from likes in 16 batches 
[2025-11-25T16:52:50.311Z] INFO: 游늳 Global stats: 5000 movies, avg 53.8 likes/movie 
[2025-11-25T16:52:50.311Z] INFO: 游꿛 STEP 5: Scoring candidate movies 
[2025-11-25T16:52:50.312Z] INFO: 游꿛 Scored 0 candidates 
[2025-11-25T16:52:50.312Z] INFO: 游끥 STEP 6: Ranking and diversifying results 
[2025-11-25T16:52:50.312Z] INFO: 游끥 Final recommendations: 
[2025-11-25T16:52:50.420Z] INFO: 游댌 Retrieved 268857 total items from likes in 16 batches 
[2025-11-25T16:52:50.561Z] INFO: 游늳 Global stats: 5000 movies, avg 53.8 likes/movie 
[2025-11-25T16:52:50.562Z] INFO: 游꿛 STEP 5: Scoring candidate movies 
[2025-11-25T16:52:50.562Z] INFO: 游꿛 Scored 0 candidates 
[2025-11-25T16:52:50.562Z] INFO: 游끥 STEP 6: Ranking and diversifying results 
[2025-11-25T16:52:50.562Z] INFO: 游끥 Final recommendations: 
