[2025-11-25T16:53:20.195Z] Processing weighted recommendation request 
[2025-11-25T16:53:20.196Z] Processing weighted recommendation request 
[2025-11-25T16:53:20.197Z] 游 generateRecommendations started with weighted algorithm 
[2025-11-25T16:53:20.197Z] 游닌 Input movie slugs: [
  "sinners-2025"
]
[2025-11-25T16:53:20.197Z] 丘뙖잺 Active weights: {
  "collaborative": 0.5,
  "favorite_bonus": 0.15,
  "genre": 0.25,
  "nanogenre": 1,
  "director": 0.05,
  "actor": 0.03,
  "temporal": 0.02
}
[2025-11-25T16:53:20.197Z] INFO: 游늵 STEP 1: Gathering input movie data 
[2025-11-25T16:53:20.197Z] 游 generateRecommendations started with weighted algorithm 
[2025-11-25T16:53:20.197Z] 游닌 Input movie slugs: [
  "sinners-2025"
]
[2025-11-25T16:53:20.198Z] 丘뙖잺 Active weights: {
  "collaborative": 0.5,
  "favorite_bonus": 0.15,
  "genre": 0.25,
  "nanogenre": 1,
  "director": 0.05,
  "actor": 0.03,
  "temporal": 0.02
}
[2025-11-25T16:53:20.198Z] INFO: 游늵 STEP 1: Gathering input movie data 
[2025-11-25T16:53:20.473Z] INFO: 游늵 Loaded 1 input movies 
[2025-11-25T16:53:20.474Z] INFO: 游논 STEP 2: Building user interaction map 
[2025-11-25T16:53:20.607Z] INFO: 游늵 Loaded 1 input movies 
[2025-11-25T16:53:20.608Z] INFO: 游논 STEP 2: Building user interaction map 
[2025-11-25T16:53:20.627Z] INFO: 游논 Movie sinners-2025 liked by users: []
[2025-11-25T16:53:20.628Z] INFO: 
游댌 DEBUG: User Interaction Analysis 
[2025-11-25T16:53:20.628Z] INFO: Total users who interacted: 0 
[2025-11-25T16:53:20.628Z] INFO: 游논 Found 0 users who interacted with input movies 
[2025-11-25T16:53:20.629Z] INFO: Userineractions: {}
[2025-11-25T16:53:20.630Z] INFO: 游꿢 STEP 3: Building candidate movie set 
[2025-11-25T16:53:20.631Z] INFO: User interactions for candidates: {}
[2025-11-25T16:53:20.631Z] INFO: 游꿢 Found 0 candidate movies 
[2025-11-25T16:53:20.631Z] INFO: 游늳 STEP 4: Calculating global statistics 
[2025-11-25T16:53:20.633Z] DEBUG: 游댌 Querying likes - batch 1 
[2025-11-25T16:53:20.752Z] INFO: 游논 Movie sinners-2025 liked by users: []
[2025-11-25T16:53:20.752Z] INFO: 
游댌 DEBUG: User Interaction Analysis 
[2025-11-25T16:53:20.753Z] INFO: Total users who interacted: 0 
[2025-11-25T16:53:20.753Z] INFO: 游논 Found 0 users who interacted with input movies 
[2025-11-25T16:53:20.753Z] INFO: Userineractions: {}
[2025-11-25T16:53:20.754Z] INFO: 游꿢 STEP 3: Building candidate movie set 
[2025-11-25T16:53:20.754Z] INFO: User interactions for candidates: {}
[2025-11-25T16:53:20.755Z] INFO: 游꿢 Found 0 candidate movies 
[2025-11-25T16:53:20.756Z] INFO: 游늳 STEP 4: Calculating global statistics 
[2025-11-25T16:53:20.756Z] DEBUG: 游댌 Querying likes - batch 1 
[2025-11-25T16:53:21.443Z] DEBUG: 游댌 Querying likes - batch 2 
[2025-11-25T16:53:21.621Z] DEBUG: 游댌 Querying likes - batch 2 
[2025-11-25T16:53:22.108Z] DEBUG: 游댌 Querying likes - batch 3 
[2025-11-25T16:53:22.169Z] DEBUG: 游댌 Querying likes - batch 3 
[2025-11-25T16:53:22.658Z] DEBUG: 游댌 Querying likes - batch 4 
[2025-11-25T16:53:22.734Z] DEBUG: 游댌 Querying likes - batch 4 
[2025-11-25T16:53:23.137Z] DEBUG: 游댌 Querying likes - batch 5 
[2025-11-25T16:53:23.504Z] DEBUG: 游댌 Querying likes - batch 5 
[2025-11-25T16:53:23.597Z] DEBUG: 游댌 Querying likes - batch 6 
[2025-11-25T16:53:24.180Z] DEBUG: 游댌 Querying likes - batch 7 
[2025-11-25T16:53:24.256Z] DEBUG: 游댌 Querying likes - batch 6 
[2025-11-25T16:53:24.722Z] DEBUG: 游댌 Querying likes - batch 8 
[2025-11-25T16:53:25.016Z] DEBUG: 游댌 Querying likes - batch 7 
[2025-11-25T16:53:25.300Z] DEBUG: 游댌 Querying likes - batch 9 
[2025-11-25T16:53:25.813Z] DEBUG: 游댌 Querying likes - batch 8 
[2025-11-25T16:53:25.966Z] DEBUG: 游댌 Querying likes - batch 10 
[2025-11-25T16:53:26.686Z] DEBUG: 游댌 Querying likes - batch 9 
[2025-11-25T16:53:27.088Z] INFO: 游댌 Progress: 175229 items from likes so far... 
[2025-11-25T16:53:27.088Z] DEBUG: 游댌 Querying likes - batch 11 
[2025-11-25T16:53:27.448Z] DEBUG: 游댌 Querying likes - batch 10 
[2025-11-25T16:53:27.784Z] DEBUG: 游댌 Querying likes - batch 12 
[2025-11-25T16:53:28.200Z] INFO: 游댌 Progress: 175229 items from likes so far... 
[2025-11-25T16:53:28.201Z] DEBUG: 游댌 Querying likes - batch 11 
[2025-11-25T16:53:28.376Z] DEBUG: 游댌 Querying likes - batch 13 
[2025-11-25T16:53:28.868Z] DEBUG: 游댌 Querying likes - batch 14 
[2025-11-25T16:53:28.965Z] DEBUG: 游댌 Querying likes - batch 12 
[2025-11-25T16:53:29.458Z] DEBUG: 游댌 Querying likes - batch 15 
[2025-11-25T16:53:29.848Z] DEBUG: 游댌 Querying likes - batch 13 
[2025-11-25T16:53:29.960Z] DEBUG: 游댌 Querying likes - batch 16 
[2025-11-25T16:53:30.211Z] INFO: 游댌 Retrieved 268857 total items from likes in 16 batches 
[2025-11-25T16:53:30.270Z] INFO: 游늳 Global stats: 5000 movies, avg 53.8 likes/movie 
[2025-11-25T16:53:30.270Z] INFO: 游꿛 STEP 5: Scoring candidate movies 
[2025-11-25T16:53:30.271Z] INFO: 游꿛 Scored 0 candidates 
[2025-11-25T16:53:30.271Z] INFO: 游끥 STEP 6: Ranking and diversifying results 
[2025-11-25T16:53:30.271Z] INFO: 游끥 Final recommendations: 
[2025-11-25T16:53:30.921Z] DEBUG: 游댌 Querying likes - batch 14 
[2025-11-25T16:53:31.961Z] DEBUG: 游댌 Querying likes - batch 15 
[2025-11-25T16:53:33.427Z] DEBUG: 游댌 Querying likes - batch 16 
[2025-11-25T16:53:34.030Z] INFO: 游댌 Retrieved 268857 total items from likes in 16 batches 
[2025-11-25T16:53:34.101Z] INFO: 游늳 Global stats: 5000 movies, avg 53.8 likes/movie 
[2025-11-25T16:53:34.101Z] INFO: 游꿛 STEP 5: Scoring candidate movies 
[2025-11-25T16:53:34.102Z] INFO: 游꿛 Scored 0 candidates 
[2025-11-25T16:53:34.102Z] INFO: 游끥 STEP 6: Ranking and diversifying results 
[2025-11-25T16:53:34.102Z] INFO: 游끥 Final recommendations: 
